message,category
"Dear customer, your M-Pesa account has been suspended. Click here to verify.",MPESA Scam
"You have received money in error. Kindly reverse immediately.",MPESA Fraud
"Your KRA PIN is blocked. Login now to reactivate.",KRA Scam
"Congratulations! You have won a betting jackpot.",Betting Scam
"Pay interview processing fee to secure your job opportunity.",Fake Job Scam
"Your bank account is under investigation. Verify immediately.",Bank Scam
"HELB account suspended. Confirm your student details now.",HELB Scam